{
  "version": 3,
  "command": "change-report",
  "ok": true,
  "identity_scheme": "nauqtype.workspace.v1",
  "before": { "workspace": "tests.impact_tool", "entry_module": "workspace:tests.impact_tool::module:app::main" },
  "after": { "workspace": "tests.impact_tool", "entry_module": "workspace:tests.impact_tool::module:app::main" },
  "evidence": { "dependencies": "checked", "call_impact": "checked", "policy": "absent" },
  "summary": {
    "added_dependencies": 0,
    "removed_dependencies": 0,
    "changed_dependencies": 1,
    "impacted_local_callers": 1,
    "policy_targets": 0,
    "policy_errors": 0
  },
  "changes": {
    "added_dependencies": [
    ],
    "removed_dependencies": [
    ],
    "changed_dependencies": [
      "workspace:tests.impact_reporting"
    ],
    "impacted_local_callers": [
      "workspace:tests.impact_tool::module:app::main::fn:main"
    ]
  },
  "policy": {
    "provided": false,
    "path": "",
    "targets": 0,
    "errors": 0,
    "malformed": false
  }
}
